<?xml version="1.0" encoding="UTF-8"?>
<pacchetti xmlns:xsi="http://www.w3.org/2001/XMLSchema-instance"
xsi:noNamespaceSchemaLocation="../xsd/pacchetti_crediti.xsd">

    <pacchetto>
        <codice>1</codice>
        <crediti>30</crediti>
        <prezzo>9.99</prezzo>
    </pacchetto>
    <pacchetto>
        <codice>2</codice>
        <crediti>50</crediti>
        <prezzo>14.99</prezzo>
    </pacchetto>
    <pacchetto>
        <codice>3</codice>
        <crediti>100</crediti>
        <prezzo>25.99</prezzo>
    </pacchetto>
    <pacchetto>
        <codice>4</codice>
        <crediti>200</crediti>
        <prezzo>45.99</prezzo>
    </pacchetto>
</pacchetti>